{
  "$schema": "../schema/gate-ai-affordance-catalog.schema.json",
  "catalogId": "metheus-gate-ai-affordances-v1",
  "version": "0.3.0",
  "status": "draft_design_proposals",
  "topologyCatalogId": "human-design-bodygraph-topology-v1",
  "topologyVersion": "1.0.0",
  "policy": "Each entry is an optional AI activity idea keyed to a source-specific Human Design gate title. It is not doctrine, a capability assessment, an intervention, or evidence of gate/channel activation or biological effect. In explicitly enabled chart-aware mode, a source-versioned calculated map or a clearly identified user-supplied gate list may provide unactivated partner-gate candidates. The AI may offer at most one candidate when it clearly advances the user's stated goal; the person decides whether it fits. Candidate presence does not establish a need, gap, or priority. An unactivated gate is not a deficit. Always describe the practical function first, keep symbolic framing optional, and do not infer needs, traits, hormones, or outcomes from a chart. Each entry also carries controlled interaction-mode labels that describe the activity format (create, organize, compare, communicate, reflect, adapt, practice, coordinate, or learn), never a user trait.",
  "entries": [
    {
      "gateNumber": 1,
      "title": "Self-Expression",
      "centerId": "g_identity",
      "channelIds": [
        "ch-1-8"
      ],
      "aiAffordance": "Offer a blank-canvas creative prompt or help revise a draft without deciding what is authentic to the person.",
      "examplePrompt": "Give me a fresh creative prompt, then help me revise my draft while keeping my voice.",
      "interactionModes": [
        "create"
      ]
    },
    {
      "gateNumber": 2,
      "title": "Higher Knowing",
      "centerId": "g_identity",
      "channelIds": [
        "ch-2-14"
      ],
      "aiAffordance": "Map options, constraints, and resources around a direction the person has already named; do not make life decisions for them.",
      "examplePrompt": "I have a direction in mind. Help me map my options, constraints, and resources without choosing for me.",
      "interactionModes": [
        "compare",
        "organize"
      ]
    },
    {
      "gateNumber": 3,
      "title": "Ordering",
      "centerId": "sacral",
      "channelIds": [
        "ch-3-60"
      ],
      "aiAffordance": "Turn a messy transition into a few small, reversible experiments and a place to note what changed.",
      "examplePrompt": "I'm in the middle of a messy change. Suggest a few small experiments I can try and revise.",
      "interactionModes": [
        "adapt",
        "organize"
      ]
    },
    {
      "gateNumber": 4,
      "title": "Formulization",
      "centerId": "ajna",
      "channelIds": [
        "ch-63-4"
      ],
      "aiAffordance": "Generate candidate explanations for a question, label assumptions, and compare them without presenting a guess as certainty.",
      "examplePrompt": "Give me several possible explanations for this question, and label assumptions and uncertainties.",
      "interactionModes": [
        "compare"
      ]
    },
    {
      "gateNumber": 5,
      "title": "Fixed Rhythms",
      "centerId": "sacral",
      "channelIds": [
        "ch-5-15"
      ],
      "aiAffordance": "Help design a routine around the person's real schedule, with flexible timing and permission to revise it.",
      "examplePrompt": "Help me make a flexible routine that fits my actual schedule and can change when needed.",
      "interactionModes": [
        "adapt",
        "organize"
      ]
    },
    {
      "gateNumber": 6,
      "title": "Friction",
      "centerId": "solar_plexus",
      "channelIds": [
        "ch-59-6"
      ],
      "aiAffordance": "Rehearse respectful boundary-setting or a difficult conversation; do not infer reproductive state, compatibility, or emotional authority.",
      "examplePrompt": "Help me prepare a respectful boundary for a difficult conversation; don't assume what anyone feels.",
      "interactionModes": [
        "communicate",
        "practice"
      ]
    },
    {
      "gateNumber": 7,
      "title": "Role of the Self",
      "centerId": "g_identity",
      "channelIds": [
        "ch-7-31"
      ],
      "aiAffordance": "Explore possible roles in a specific project and the responsibilities each would involve, without assigning a fixed role or destiny.",
      "examplePrompt": "Help me compare possible roles for this project and what each role would involve.",
      "interactionModes": [
        "compare",
        "organize"
      ]
    },
    {
      "gateNumber": 8,
      "title": "Contribution",
      "centerId": "throat",
      "channelIds": [
        "ch-1-8"
      ],
      "aiAffordance": "Help shape a contribution for a chosen audience while preserving the person's voice and credit.",
      "examplePrompt": "Help me shape this contribution for its audience while preserving my voice and giving proper credit.",
      "interactionModes": [
        "communicate",
        "create"
      ]
    },
    {
      "gateNumber": 9,
      "title": "Focus",
      "centerId": "sacral",
      "channelIds": [
        "ch-9-52"
      ],
      "aiAffordance": "Break a chosen task into a short sequence, identify likely distractions, and let the person choose a stopping point.",
      "examplePrompt": "Help me break this task into a few steps and choose a stopping point that works for me.",
      "interactionModes": [
        "organize"
      ]
    },
    {
      "gateNumber": 10,
      "title": "Behavior of the Self",
      "centerId": "g_identity",
      "channelIds": [
        "ch-10-20",
        "ch-10-34",
        "ch-10-57"
      ],
      "aiAffordance": "Help compare an intended action with the person's stated values and context, without labeling their personality or judging their worth.",
      "examplePrompt": "Help me compare this possible action with values I've named, without judging me.",
      "interactionModes": [
        "compare",
        "reflect"
      ]
    },
    {
      "gateNumber": 11,
      "title": "Ideas",
      "centerId": "ajna",
      "channelIds": [
        "ch-11-56"
      ],
      "aiAffordance": "Offer a few diverse, relevant questions or idea connections, then invite the person to choose one and tell or develop it.",
      "examplePrompt": "Give me a few varied questions or connections about this topic so I can choose one to explore.",
      "interactionModes": [
        "create"
      ]
    },
    {
      "gateNumber": 12,
      "title": "Caution",
      "centerId": "throat",
      "channelIds": [
        "ch-12-22"
      ],
      "aiAffordance": "Draft a message in several tones and let the person choose whether, when, or whether not to send it.",
      "examplePrompt": "Draft a few versions of this message in different tones; I will decide whether to send one.",
      "interactionModes": [
        "communicate",
        "create"
      ]
    },
    {
      "gateNumber": 13,
      "title": "Listener",
      "centerId": "g_identity",
      "channelIds": [
        "ch-13-33"
      ],
      "aiAffordance": "Provide a user-controlled listening or journaling prompt and reflect back only what the person chose to share. Avoid inviting unnecessary third-party secrets.",
      "examplePrompt": "Ask me a few gentle questions to help me reflect on an experience I choose to share.",
      "interactionModes": [
        "communicate",
        "reflect"
      ]
    },
    {
      "gateNumber": 14,
      "title": "Power Skills",
      "centerId": "sacral",
      "channelIds": [
        "ch-2-14"
      ],
      "aiAffordance": "Inventory skills and resources the person wants to use toward a chosen goal; avoid claims of innate power or guaranteed success.",
      "examplePrompt": "Help me list the skills and resources I want to bring to this goal.",
      "interactionModes": [
        "compare",
        "organize"
      ]
    },
    {
      "gateNumber": 15,
      "title": "Extremes",
      "centerId": "g_identity",
      "channelIds": [
        "ch-5-15"
      ],
      "aiAffordance": "Help design a flexible routine with acceptable variation and recovery options rather than forcing uniformity.",
      "examplePrompt": "Help me create a routine with room for variation, rest, and changing circumstances.",
      "interactionModes": [
        "adapt",
        "organize"
      ]
    },
    {
      "gateNumber": 16,
      "title": "Skills",
      "centerId": "throat",
      "channelIds": [
        "ch-48-16"
      ],
      "aiAffordance": "Build a small, repeatable practice plan and a self-chosen feedback checklist for a skill.",
      "examplePrompt": "Make a short practice plan for this skill and a feedback checklist I can adjust.",
      "interactionModes": [
        "practice",
        "organize"
      ]
    },
    {
      "gateNumber": 17,
      "title": "Opinions",
      "centerId": "ajna",
      "channelIds": [
        "ch-17-62"
      ],
      "aiAffordance": "Compare viewpoints on a topic and distinguish observable evidence from interpretation and preference.",
      "examplePrompt": "Compare these viewpoints and separate observable evidence from interpretation and preference.",
      "interactionModes": [
        "compare"
      ]
    },
    {
      "gateNumber": 18,
      "title": "Correction",
      "centerId": "spleen",
      "channelIds": [
        "ch-18-58"
      ],
      "aiAffordance": "Give feedback on a user-selected draft or process using specific observations, an invitation to revise, and strengths as well as issues.",
      "examplePrompt": "Review this draft or process with specific, constructive feedback and room for revision.",
      "interactionModes": [
        "practice",
        "communicate"
      ]
    },
    {
      "gateNumber": 19,
      "title": "Wanting",
      "centerId": "root",
      "channelIds": [
        "ch-19-49"
      ],